{
  "schema_version": "1.0",
  "source_of_truth": "docs_control/verify_runs.json",
  "notes": [
    "Canonical verify run log for deterministic ERROR LOOP / MkDocs generated views.",
    "Markdown pages in docs/generated/control are generated views only."
  ],
  "runs": [
    {
      "run_id": "vr-b0e78bd15bc74a60af0f581e2adba399",
      "created_at_utc": "2026-02-26T18:45:55.402Z",
      "created_at_epoch_ms": 1772127955402,
      "task_id": "verify-fast-20260226T184526Z",
      "commit_sha": "2ef8b818874d0e2d2ce47d9a2ecaacb4dba53d4f",
      "stage": "fast",
      "scope": "repo",
      "status": "PASS",
      "steps": [
        {
          "name": "Validate workflow alignment",
          "tool": "pwsh",
          "command": "pwsh -NoProfile -ExecutionPolicy Bypass -File C:\\Users\\adamf\\OneDrive\\Dokumenty\\aSTT-RUST\\scripts\\validate_workflow_alignment.ps1",
          "status": "PASS",
          "duration_ms": 434,
          "exit_code": 0
        },
        {
          "name": "Validate workflow control plane model",
          "tool": "pwsh",
          "command": "pwsh -NoProfile -ExecutionPolicy Bypass -File C:\\Users\\adamf\\OneDrive\\Dokumenty\\aSTT-RUST\\scripts\\validate_workflow_control_plane.ps1 -RootPath C:\\Users\\adamf\\OneDrive\\Dokumenty\\aSTT-RUST",
          "status": "PASS",
          "duration_ms": 655,
          "exit_code": 0
        },
        {
          "name": "Validate workflow control alignment (refresh observed)",
          "tool": "pwsh",
          "command": "pwsh -NoProfile -ExecutionPolicy Bypass -File C:\\Users\\adamf\\OneDrive\\Dokumenty\\aSTT-RUST\\scripts\\validate_workflow_control_alignment.ps1 -RootPath C:\\Users\\adamf\\OneDrive\\Dokumenty\\aSTT-RUST -RefreshObserved",
          "status": "PASS",
          "duration_ms": 1904,
          "exit_code": 0
        },
        {
          "name": "Capability audit (tools + sources)",
          "tool": "pwsh",
          "command": "pwsh -NoProfile -ExecutionPolicy Bypass -File C:\\Users\\adamf\\OneDrive\\Dokumenty\\aSTT-RUST\\scripts\\validate_capability_audit.ps1 -RootPath C:\\Users\\adamf\\OneDrive\\Dokumenty\\aSTT-RUST",
          "status": "PASS",
          "duration_ms": 779,
          "exit_code": 0
        },
        {
          "name": "Preflight state discovery (claim=evidence)",
          "tool": "pwsh",
          "command": "pwsh -NoProfile -ExecutionPolicy Bypass -File C:\\Users\\adamf\\OneDrive\\Dokumenty\\aSTT-RUST\\scripts\\preflight_state_discovery.ps1 -RootPath C:\\Users\\adamf\\OneDrive\\Dokumenty\\aSTT-RUST",
          "status": "PASS",
          "duration_ms": 1320,
          "exit_code": 0
        },
        {
          "name": "Verify batch status claims (claim=evidence)",
          "tool": "pwsh",
          "command": "pwsh -NoProfile -ExecutionPolicy Bypass -File C:\\Users\\adamf\\OneDrive\\Dokumenty\\aSTT-RUST\\scripts\\verify_batch_status.ps1 -RootPath C:\\Users\\adamf\\OneDrive\\Dokumenty\\aSTT-RUST",
          "status": "PASS",
          "duration_ms": 1059,
          "exit_code": 0
        },
        {
          "name": "Validate traceability registry",
          "tool": "pwsh",
          "command": "pwsh -NoProfile -ExecutionPolicy Bypass -File C:\\Users\\adamf\\OneDrive\\Dokumenty\\aSTT-RUST\\scripts\\validate_traceability.ps1 -RootPath C:\\Users\\adamf\\OneDrive\\Dokumenty\\aSTT-RUST",
          "status": "PASS",
          "duration_ms": 460,
          "exit_code": 0
        },
        {
          "name": "Validate NEXT_SESSION control (JSON-first)",
          "tool": "pwsh",
          "command": "pwsh -NoProfile -ExecutionPolicy Bypass -File C:\\Users\\adamf\\OneDrive\\Dokumenty\\aSTT-RUST\\scripts\\validate_next_session.ps1 -RootPath C:\\Users\\adamf\\OneDrive\\Dokumenty\\aSTT-RUST -SkipGeneratedFreshnessCheck",
          "status": "PASS",
          "duration_ms": 482,
          "exit_code": 0
        },
        {
          "name": "Enforce NEXT_SESSION flow",
          "tool": "pwsh",
          "command": "pwsh -NoProfile -ExecutionPolicy Bypass -File C:\\Users\\adamf\\OneDrive\\Dokumenty\\aSTT-RUST\\scripts\\enforce_next_session_flow.ps1",
          "status": "PASS",
          "duration_ms": 2450,
          "exit_code": 0
        },
        {
          "name": "Control docs stale-check",
          "tool": "pwsh",
          "command": "pwsh -NoProfile -ExecutionPolicy Bypass -File C:\\Users\\adamf\\OneDrive\\Dokumenty\\aSTT-RUST\\scripts\\generate_control_docs.ps1 -RootPath C:\\Users\\adamf\\OneDrive\\Dokumenty\\aSTT-RUST -CheckOnly",
          "status": "PASS",
          "duration_ms": 525,
          "exit_code": 0
        },
        {
          "name": "Workflow control diagrams stale-check",
          "tool": "pwsh",
          "command": "pwsh -NoProfile -ExecutionPolicy Bypass -File C:\\Users\\adamf\\OneDrive\\Dokumenty\\aSTT-RUST\\scripts\\generate_workflow_control_diagrams.ps1 -RootPath C:\\Users\\adamf\\OneDrive\\Dokumenty\\aSTT-RUST -CheckOnly",
          "status": "PASS",
          "duration_ms": 1298,
          "exit_code": 0
        },
        {
          "name": "Markdown lint (pre-commit, blocking scope)",
          "tool": "markdownlint-cli2",
          "command": "C:\\Users\\adamf\\OneDrive\\Dokumenty\\aSTT-RUST\\.venv\\Scripts\\pre-commit.exe run markdownlint-cli2 --all-files",
          "status": "PASS",
          "duration_ms": 1508,
          "exit_code": 0
        },
        {
          "name": "Markdown lint backlog report (non-blocking)",
          "tool": "pwsh",
          "command": "pwsh -NoProfile -ExecutionPolicy Bypass -File C:\\Users\\adamf\\OneDrive\\Dokumenty\\aSTT-RUST\\scripts\\report_markdownlint_backlog.ps1 -RootPath C:\\Users\\adamf\\OneDrive\\Dokumenty\\aSTT-RUST",
          "status": "PASS",
          "duration_ms": 2094,
          "exit_code": 0
        },
        {
          "name": "Vale prose lint (critical blocking, pre-commit)",
          "tool": "vale",
          "command": "C:\\Users\\adamf\\OneDrive\\Dokumenty\\aSTT-RUST\\.venv\\Scripts\\pre-commit.exe run vale-critical --all-files",
          "status": "PASS",
          "duration_ms": 1203,
          "exit_code": 0
        },
        {
          "name": "Vale backlog report + no-regression",
          "tool": "vale",
          "command": "pwsh -NoProfile -ExecutionPolicy Bypass -File C:\\Users\\adamf\\OneDrive\\Dokumenty\\aSTT-RUST\\scripts\\report_vale_backlog.ps1 -RootPath C:\\Users\\adamf\\OneDrive\\Dokumenty\\aSTT-RUST -EnforceNoRegression",
          "status": "PASS",
          "duration_ms": 9815,
          "exit_code": 0
        },
        {
          "name": "Link audit (lychee, optional)",
          "tool": "lychee",
          "command": "C:\\Users\\adamf\\OneDrive\\Dokumenty\\aSTT-RUST\\.venv\\Scripts\\pre-commit.exe run lychee --all-files",
          "status": "SKIP",
          "duration_ms": 0,
          "exit_code": null
        },
        {
          "name": "MkDocs build --strict",
          "tool": "mkdocs",
          "command": "C:\\Users\\adamf\\OneDrive\\Dokumenty\\aSTT-RUST\\.venv\\Scripts\\python.exe -X utf8 -m mkdocs build --strict -f C:\\Users\\adamf\\OneDrive\\Dokumenty\\aSTT-RUST\\mkdocs.yml",
          "status": "PASS",
          "duration_ms": 1872,
          "exit_code": 0
        }
      ],
      "errors": [],
      "error_count": 0,
      "fingerprints": [],
      "root_cause": null,
      "evidence_refs": [
        "logs/verify/raw/20260226T184526Z-fast-cec8fc98/01_Validate_workflow_alignment.log",
        "logs/verify/raw/20260226T184526Z-fast-cec8fc98/02_Validate_workflow_control_plane_model.log",
        "logs/verify/raw/20260226T184526Z-fast-cec8fc98/03_Validate_workflow_control_alignment_refresh_observed.log",
        "logs/verify/raw/20260226T184526Z-fast-cec8fc98/04_Capability_audit_tools_sources.log",
        "logs/verify/raw/20260226T184526Z-fast-cec8fc98/05_Preflight_state_discovery_claim_evidence.log",
        "logs/verify/raw/20260226T184526Z-fast-cec8fc98/06_Verify_batch_status_claims_claim_evidence.log",
        "logs/verify/raw/20260226T184526Z-fast-cec8fc98/07_Validate_traceability_registry.log",
        "logs/verify/raw/20260226T184526Z-fast-cec8fc98/08_Validate_NEXT_SESSION_control_JSON-first.log",
        "logs/verify/raw/20260226T184526Z-fast-cec8fc98/09_Enforce_NEXT_SESSION_flow.log",
        "logs/verify/raw/20260226T184526Z-fast-cec8fc98/10_Control_docs_stale-check.log",
        "logs/verify/raw/20260226T184526Z-fast-cec8fc98/11_Workflow_control_diagrams_stale-check.log",
        "logs/verify/raw/20260226T184526Z-fast-cec8fc98/12_Markdown_lint_pre-commit_blocking_scope.log",
        "logs/verify/raw/20260226T184526Z-fast-cec8fc98/13_Markdown_lint_backlog_report_non-blocking.log",
        "logs/verify/raw/20260226T184526Z-fast-cec8fc98/14_Vale_prose_lint_critical_blocking_pre-commit.log",
        "logs/verify/raw/20260226T184526Z-fast-cec8fc98/15_Vale_backlog_report_no-regression.log",
        "logs/verify/raw/20260226T184526Z-fast-cec8fc98/17_MkDocs_build_--strict.log"
      ]
    },
    {
      "run_id": "vr-0e4a2c518b064bdebfc1c237d02f3a15",
      "created_at_utc": "2026-02-26T18:38:13.672Z",
      "created_at_epoch_ms": 1772127493672,
      "task_id": "verify-fast-20260226T183743Z",
      "commit_sha": "2ef8b818874d0e2d2ce47d9a2ecaacb4dba53d4f",
      "stage": "fast",
      "scope": "repo",
      "status": "PASS",
      "steps": [
        {
          "name": "Validate workflow alignment",
          "tool": "pwsh",
          "command": "pwsh -NoProfile -ExecutionPolicy Bypass -File C:\\Users\\adamf\\OneDrive\\Dokumenty\\aSTT-RUST\\scripts\\validate_workflow_alignment.ps1",
          "status": "PASS",
          "duration_ms": 407,
          "exit_code": 0
        },
        {
          "name": "Validate workflow control plane model",
          "tool": "pwsh",